{
  "schema_version": "1.0.0",
  "pack_id": "CUSTOMER-NORM-PACK-REPLACE",
  "version": "0.0.0-draft",
  "title": "Customer norm pack intake template (do not mark customer_approved until signed)",
  "typology": "REPLACE-TYPOLOGY",
  "jurisdiction": "RF",
  "edition": "REPLACE-EDITION",
  "disciplines": ["AR"],
  "status": "draft",
  "claim_labels": ["draft", "not-customer-evidence", "template"],
  "approval": null,
  "approval_ref": null,
  "customer_action_required": "Provide signed approval object (approved_by, approval_date, approval_status, document_title, document_edition, effective_date, scope_reference) + pack_hash + jurisdiction + per-rule clause before status=customer_approved (RT-002).",
  "rules": [
    {
      "rule_id": "CUST-PLACEHOLDER-001",
      "scope": "ifc-property",
      "ifc_entity": "IfcSpace",
      "property_set": "Pset_SpaceCommon",
      "property_name": "IsExternal",
      "operator": "exists",
      "expected_value": null,
      "evidence_text": "Replace with customer criterion",
      "norm_source": null,
      "norm_edition": null,
      "norm_clause": null,
      "approval_status": "draft",
      "approval_ref": null,
      "severity": "warning",
      "finding_class": "attribute",
      "rase": {
        "requirement": "Replace: normative requirement statement",
        "applicability": "Replace: which IfcSpace / storeys / stage",
        "selection": "Pset_SpaceCommon.IsExternal exists",
        "exception": "Replace or null if none"
      },
      "test_example_ref": "REPLACE-fixture-or-test-id"
    }
  ]
}
