{
  "schema_version": "2.0.0",
  "pack_id": "AEROBIM-NORM-PACK-V2-DRAFT-EXAMPLE",
  "version": "0.1.0-draft",
  "title": "Norm pack v2 draft example (RASE + expert journal; not customer_approved)",
  "typology": "residential-multifamily",
  "jurisdiction": "RF",
  "edition": "2026-08-draft",
  "norm_edition": "SP-54.13330-draft",
  "norm_edition_date": "2026-08-01",
  "disciplines": ["AR"],
  "status": "draft",
  "claim_labels": ["draft", "fixture", "not-customer-evidence", "template"],
  "approval": null,
  "approval_ref": null,
  "customer_approval_ref": null,
  "customer_action_required": "WP-04 example only. Promote to customer_approved only with full approval object + pack_hash. Expert confirmation journal does not close RT-002.",
  "rules": [
    {
      "rule_id": "V2-AR-SPACE-EXTERNAL-001",
      "scope": "ifc-property",
      "ifc_entity": "IfcSpace",
      "object_type": "IfcSpace",
      "property_set": "Pset_SpaceCommon",
      "property_name": "IsExternal",
      "operator": "exists",
      "expected_value": null,
      "source": "СП 54.13330",
      "norm_source": "СП 54.13330",
      "norm_edition": "2022",
      "clause_number": "7.1.2",
      "requirement_text": "IsExternal shall be present on IfcSpace in residential pilot scope.",
      "evidence_text": "IsExternal shall be present on IfcSpace in residential pilot scope.",
      "discipline": "AR",
      "stage": "RD",
      "criticality": "warning",
      "evidence_required": true,
      "execution_mode": "deterministic",
      "approval_status": "draft",
      "approval_ref": null,
      "rase": {
        "requirement": "IsExternal shall be present on IfcSpace in residential pilot scope",
        "applicability": "IfcSpace in agreed building storeys; stage RD",
        "selection": "Pset_SpaceCommon.IsExternal exists",
        "exclusion": "Technical shafts marked out of scope in scope memo"
      },
      "expert_confirmation_journal": [
        {
          "confirmed_by": "eng-fixture-expert",
          "confirmed_at": "2026-08-02T12:00:00+03:00",
          "decision": "confirmed",
          "note": "Fixture confirmation for WP-04 regression only; not customer approval"
        }
      ],
      "test_example_ref": "test_norm_rule_pack_v2.V2-AR-SPACE-EXTERNAL-001"
    },
    {
      "rule_id": "V2-AR-FIRE-RATING-EXPERT-001",
      "scope": "ifc-property",
      "ifc_entity": "IfcWall",
      "object_type": "IfcWall",
      "property_set": "Pset_WallCommon",
      "property_name": "FireRating",
      "operator": "exists",
      "expected_value": null,
      "source": "СП 2.13130",
      "norm_source": "СП 2.13130",
      "norm_edition": "2020",
      "clause_number": "5.4.1",
      "requirement_text": "FireRating interpretation requires expert judgment for wall type classes.",
      "evidence_text": "FireRating interpretation requires expert judgment for wall type classes.",
      "discipline": "AR",
      "stage": "PD",
      "criticality": "critical",
      "evidence_required": true,
      "execution_mode": "expert_required",
      "approval_status": "draft",
      "approval_ref": null,
      "rase": {
        "requirement": "FireRating shall be assigned consistently with wall fire compartment class",
        "applicability": "IfcWall enclosing residential fire compartments",
        "selection": "Pset_WallCommon.FireRating exists",
        "exclusion": "Non-fire-rated partition walls declared out of scope"
      },
      "expert_confirmation_journal": [],
      "test_example_ref": "test_norm_rule_pack_v2.V2-AR-FIRE-RATING-EXPERT-001"
    },
    {
      "rule_id": "V2-AR-AWAITING-CONFIRM-001",
      "scope": "ifc-property",
      "ifc_entity": "IfcSpace",
      "object_type": "IfcSpace",
      "property_set": "Pset_SpaceCommon",
      "property_name": "OccupancyType",
      "operator": "exists",
      "expected_value": null,
      "source": "EIR-draft",
      "norm_source": "EIR-draft",
      "norm_edition": "2026-08",
      "clause_number": "3.2",
      "requirement_text": "OccupancyType must be present (LLM-drafted; awaiting expert journal).",
      "discipline": "AR",
      "stage": "RD",
      "criticality": "info",
      "evidence_required": false,
      "execution_mode": "deterministic",
      "approval_status": "draft",
      "rase": {
        "requirement": "OccupancyType must be present on IfcSpace",
        "applicability": "All IfcSpace in pilot building",
        "selection": "Pset_SpaceCommon.OccupancyType exists",
        "exclusion": "None"
      },
      "expert_confirmation_journal": [],
      "test_example_ref": "test_norm_rule_pack_v2.V2-AR-AWAITING-CONFIRM-001"
    }
  ]
}
