{
  "schema_version": "2.0.0",
  "pack_id": "MOSCOW-AGR-2026",
  "version": "0.1.0",
  "title": "Moscow AGR CIM 2026 — AR property subset (city-published IDS, not appointing-party)",
  "typology": "residential-multifamily",
  "jurisdiction": "г. Москва",
  "edition": "2026-04",
  "norm_edition": "ДГП-Р-1/26",
  "norm_edition_date": "2026-04-02",
  "disciplines": [
    "AR"
  ],
  "status": "approved",
  "customer_action_required": "City published CIM AGR filing requirements. The city is not AeroBIM's customer and did not endorse the product. Appointing-party internals remain out of scope. RT-002 is closed in regulatory volume only; corporate volume stays open.",
  "approval_ref": "ДГП-Р-1/26/64-16-6/26",
  "customer_approval_ref": "ДГП-Р-1/26/64-16-6/26",
  "approval": {
    "approved_by": "Департамент градостроительной политики города Москвы (издатель NPA; не заказчик AeroBIM)",
    "approval_date": "2026-01-16T00:00:00+03:00",
    "approval_status": "approved",
    "document_title": "Распоряжение ДГП № ДГП-Р-1/26/64-16-6/26 — требования к ЦИМ АГР (IFC + машиночитаемый IDS)",
    "document_edition": "2026-04",
    "effective_date": "2026-04-02",
    "scope_reference": "ДГП-Р-1/26/64-16-6/26; stroimprosto IDS ЦИМ АГР (IfcSpace RusSet_*)"
  },
  "rules": [
    {
      "rule_id": "AGR-AR-SPACE-NAME-001",
      "scope": "ifc-property",
      "ifc_entity": "IfcSpace",
      "object_type": "IfcSpace",
      "property_set": "RusSet_Common",
      "property_name": "RUS_Name",
      "operator": "exists",
      "expected_value": null,
      "source": "ДГП-Р-1/26 + IDS АГР_Общие требования v9 (IfcSpace)",
      "norm_source": "ДГП-Р-1/26",
      "norm_edition": "2026-04",
      "clause_number": "CIM-AGR-IDS:IfcSpace:RUS_Name",
      "requirement_text": "IfcSpace in Moscow AGR CIM shall carry RusSet_Common.RUS_Name (city IDS applicability).",
      "evidence_text": "Property presence on IfcSpace; city IDS pack, not a customer EIR.",
      "discipline": "AR",
      "stage": "PD",
      "criticality": "warning",
      "evidence_required": true,
      "execution_mode": "deterministic",
      "rase": {
        "requirement": "IfcSpace shall have RusSet_Common.RUS_Name",
        "applicability": "IfcSpace selected by city AGR IDS (studio-apartment flag in RusSet_AGR where specified)",
        "selection": "RusSet_Common.RUS_Name exists",
        "exclusion": "Spaces marked out of AGR CIM applicability in the city IDS"
      },
      "expert_confirmation_journal": []
    },
    {
      "rule_id": "AGR-AR-SPACE-AREA-001",
      "scope": "ifc-property",
      "ifc_entity": "IfcSpace",
      "object_type": "IfcSpace",
      "property_set": "RusSet_Quantities",
      "property_name": "RUS_Area",
      "operator": "exists",
      "expected_value": null,
      "source": "ДГП-Р-1/26 + IDS АГР_Общие требования v9 (IfcSpace)",
      "norm_source": "ДГП-Р-1/26",
      "norm_edition": "2026-04",
      "clause_number": "CIM-AGR-IDS:IfcSpace:RUS_Area",
      "requirement_text": "IfcSpace in Moscow AGR CIM shall carry RusSet_Quantities.RUS_Area.",
      "evidence_text": "Property presence on IfcSpace; seam with schedule area is a separate cross-document check.",
      "discipline": "AR",
      "stage": "PD",
      "criticality": "critical",
      "evidence_required": true,
      "execution_mode": "deterministic",
      "rase": {
        "requirement": "IfcSpace shall have RusSet_Quantities.RUS_Area",
        "applicability": "IfcSpace in AGR CIM AR subset",
        "selection": "RusSet_Quantities.RUS_Area exists",
        "exclusion": "Non-area technical voids excluded by city IDS applicability"
      },
      "expert_confirmation_journal": []
    },
    {
      "rule_id": "AGR-AR-SPACE-NUMBER-001",
      "scope": "ifc-property",
      "ifc_entity": "IfcSpace",
      "object_type": "IfcSpace",
      "property_set": "RusSet_Identification",
      "property_name": "RUS_Number",
      "operator": "exists",
      "expected_value": null,
      "source": "ДГП-Р-1/26 + IDS АГР_Общие требования v9 (IfcSpace)",
      "norm_source": "ДГП-Р-1/26",
      "norm_edition": "2026-04",
      "clause_number": "CIM-AGR-IDS:IfcSpace:RUS_Number",
      "requirement_text": "IfcSpace in Moscow AGR CIM shall carry RusSet_Identification.RUS_Number.",
      "evidence_text": "Property presence on IfcSpace.",
      "discipline": "AR",
      "stage": "PD",
      "criticality": "warning",
      "evidence_required": true,
      "execution_mode": "deterministic",
      "rase": {
        "requirement": "IfcSpace shall have RusSet_Identification.RUS_Number",
        "applicability": "IfcSpace in AGR CIM AR subset",
        "selection": "RusSet_Identification.RUS_Number exists",
        "exclusion": "Unnumbered service spaces excluded by city IDS applicability"
      },
      "expert_confirmation_journal": []
    },
    {
      "rule_id": "AGR-AR-SPACE-OBJECT-001",
      "scope": "ifc-property",
      "ifc_entity": "IfcSpace",
      "object_type": "IfcSpace",
      "property_set": "RusSet_Location",
      "property_name": "RUS_Object",
      "operator": "exists",
      "expected_value": null,
      "source": "ДГП-Р-1/26 + IDS АГР_Общие требования v9 (IfcSpace)",
      "norm_source": "ДГП-Р-1/26",
      "norm_edition": "2026-04",
      "clause_number": "CIM-AGR-IDS:IfcSpace:RUS_Object",
      "requirement_text": "IfcSpace in Moscow AGR CIM shall carry RusSet_Location.RUS_Object (building / corpus number).",
      "evidence_text": "Property presence on IfcSpace.",
      "discipline": "AR",
      "stage": "PD",
      "criticality": "warning",
      "evidence_required": true,
      "execution_mode": "deterministic",
      "rase": {
        "requirement": "IfcSpace shall have RusSet_Location.RUS_Object",
        "applicability": "IfcSpace in AGR CIM AR subset",
        "selection": "RusSet_Location.RUS_Object exists",
        "exclusion": "Off-plot spaces excluded by city IDS applicability"
      },
      "expert_confirmation_journal": []
    },
    {
      "rule_id": "AGR-AR-WALL-NAME-001",
      "scope": "ifc-property",
      "ifc_entity": "IfcWall",
      "object_type": "IfcWall",
      "property_set": "RusSet_Common",
      "property_name": "RUS_Name",
      "operator": "exists",
      "expected_value": null,
      "source": "ДГП-Р-1/26 + IDS АГР_Общие требования v9 (IfcWall)",
      "norm_source": "ДГП-Р-1/26",
      "norm_edition": "2026-04",
      "clause_number": "CIM-AGR-IDS:IfcWall:RUS_Name",
      "requirement_text": "IfcWall in Moscow AGR CIM shall carry RusSet_Common.RUS_Name.",
      "evidence_text": "Property presence on IfcWall; small AR subset, not 389 MOGE specs.",
      "discipline": "AR",
      "stage": "PD",
      "criticality": "warning",
      "evidence_required": true,
      "execution_mode": "deterministic",
      "rase": {
        "requirement": "IfcWall shall have RusSet_Common.RUS_Name",
        "applicability": "IfcWall in AGR CIM AR subset",
        "selection": "RusSet_Common.RUS_Name exists",
        "exclusion": "Temporary partitions excluded by city IDS applicability"
      },
      "expert_confirmation_journal": []
    },
    {
      "rule_id": "AGR-AR-WALL-THICKNESS-001",
      "scope": "ifc-property",
      "ifc_entity": "IfcWall",
      "object_type": "IfcWall",
      "property_set": "RusSet_Quantities",
      "property_name": "RUS_Thickness",
      "operator": "exists",
      "expected_value": null,
      "source": "ДГП-Р-1/26 + IDS АГР_Общие требования v9 (IfcWall)",
      "norm_source": "ДГП-Р-1/26",
      "norm_edition": "2026-04",
      "clause_number": "CIM-AGR-IDS:IfcWall:RUS_Thickness",
      "requirement_text": "IfcWall in Moscow AGR CIM shall carry RusSet_Quantities.RUS_Thickness.",
      "evidence_text": "Property presence on IfcWall.",
      "discipline": "AR",
      "stage": "PD",
      "criticality": "warning",
      "evidence_required": true,
      "execution_mode": "deterministic",
      "rase": {
        "requirement": "IfcWall shall have RusSet_Quantities.RUS_Thickness",
        "applicability": "IfcWall in AGR CIM AR subset",
        "selection": "RusSet_Quantities.RUS_Thickness exists",
        "exclusion": "Zero-thickness virtual walls excluded by city IDS applicability"
      },
      "expert_confirmation_journal": []
    }
  ],
  "pack_hash": "5677885009ab1ff3a00c74217d6387b2547de9c7a2e761da6d2ed743e46290a6"
}
